{
  "v": 1,
  "device_id": "3f2b8c1e-9d4a-4e7b-a1c6-5f8e2d9b0a73",
  "device_name": "My MacBook Pro",
  "seq": 42,
  "lamport": 117,
  "action": "deleted",
  "path": "Documents/finances.pdf",
  "old_path": null,
  "hash": null,
  "base_hash": "60303ae22b998861bce3b28f33eec1be758a213c86c93c076dbe9f558c11c752",
  "size": null,
  "mtime_ms": null,
  "blob_id": null
}
