{
  "v": 1,
  "device_id": "3f2b8c1e-9d4a-4e7b-a1c6-5f8e2d9b0a73",
  "device_name": "My MacBook Pro",
  "seq": 42,
  "lamport": 117,
  "action": "modified",
  "path": "Documents/finances.pdf",
  "old_path": null,
  "hash": "60303ae22b998861bce3b28f33eec1be758a213c86c93c076dbe9f558c11c752",
  "base_hash": "9f86d081884c7d659a2feaa0c55ad015a3bf4f1b2b0b822cd15d6c15b0f00a08",
  "size": 49102,
  "mtime_ms": 1760581200000,
  "blob_id": "60303ae22b998861bce3b28f33eec1be758a213c86c93c076dbe9f558c11c752"
}
